{
  "$schema": "https://langgra.ph/schema.json",
  "python_version": "3.12",
  "dependencies": [
    "."
  ],
  "env": ".env",
  "graphs": {
    "pixelflow": "pixelflow:make_pixelflow_graph",
    "lead_agent": "deerflow.agents:make_lead_agent",
    "pixelflow_agent_runtime": "pixelflow.agent_runtime.graph:make_agent_runtime_graph"
  },
  "auth": {
    "path": "./app/gateway/langgraph_auth.py:auth"
  },
  "checkpointer": {
    "path": "./packages/harness/deerflow/runtime/checkpointer/async_provider.py:make_checkpointer"
  }
}
